{"awq_version":"0.35.0","profiles":["core","discussion-batch","discussion-persistence","discussion-reconciliation","docs","github-actions","interaction-gates","privacy","python","schemas","shell","supply-chain"],"registry_sha256":"ff3688f8ee7bc817d8f3eb8a9c4c1485129399add09c47463ce0b21231f2bcf4","requirements":["AWQ-CORE-001","AWQ-CORE-002","AWQ-CORE-003","AWQ-CORE-004","AWQ-DOC-001","AWQ-GHA-001","AWQ-GHA-002","AWQ-GHA-003","AWQ-ORACLE-001","AWQ-ORACLE-002","AWQ-ORACLE-004","AWQ-ORACLE-005","AWQ-ORACLE-006","AWQ-PRIV-001","AWQ-PY-001","AWQ-SCHEMA-001","AWQ-SHELL-001","AWQ-SUPPLY-001"],"schema_version":1}
